title,content
Account Overview,Learn how to navigate and understand your account summary including balances recent transactions and account history.
Fund Transfers,Get step-by-step instructions on transferring funds between your accounts or to other banks in a secure and timely manner.
Setting Up Direct Deposit,Find out how to set up direct deposit so your paycheck goes directly into your bank account without any added steps.
Updating Personal Information,Learn how to update your personal details including address phone number and email to keep your account secure.
Forgot Username or Password,If you're having trouble logging in follow these steps to recover your username or reset your password safely.
Dispute a Transaction,Learn how to report and dispute transactions that may appear fraudulent or incorrect on your account.
Applying for a Loan,Discover the different types of loans available including personal and auto loans and learn how to apply for each.
Setting Up Alerts,Customize account alerts for low balances large transactions or other activities to stay up-to-date with your finances.
Understanding Fees,Find out about fees associated with various transactions overdrafts and monthly account maintenance.
Contact Customer Support,If you need help here’s how to reach our support team by phone email or chat for any banking questions or issues.